{
  "$schema": "../schemas/run-config-v1.schema.json",
  "schema_version": 1,
  "model": {
    "id": "deepseek/deepseek-v4.1-flash",
    "context_length": 1048576,
    "max_output_tokens": 65536,
    "supports_tools": true
  },
  "samples_per_task": 1,
  "max_repair_turns": 1,
  "max_tool_calls_per_attempt": null,
  "max_workspace_tool_calls_per_attempt": null,
  "max_agent_iterations": 80
}
